{
  "schema_version": "export-variant.v1",
  "export_id": "export_20260814T165501Z",
  "minecraft_version": "26.2",
  "variant_id": "minecraft:yellow_carpet",
  "block_id": "minecraft:yellow_carpet",
  "canonical_state_id": "minecraft:yellow_carpet",
  "represented_state_ids": ["minecraft:yellow_carpet"],
  "context": {
    "fixture_id": "isolated",
    "fixture_version": "fixture.v1",
    "rotatable": true,
    "canonical_orientation": null,
    "adjacency": []
  },
  "selection": {
    "state_policy_version": "state-policy.v1",
    "reason": "default",
    "protected_dimensions": [],
    "folded_state_ids": [],
    "policy_override_id": null
  },
  "status": "selected",
  "candidate_qualification": "eligible",
  "warnings": [],
  "machine_facts": {
    "geometry_signature": "sha256:0000000000000000000000000000000000000000000000000000000000000000",
    "collision_signature": "sha256:0000000000000000000000000000000000000000000000000000000000000000",
    "shape": {
      "boxes": [{ "min_x": 0, "min_y": 0, "min_z": 0, "max_x": 1, "max_y": 0.0625, "max_z": 1 }],
      "signature": "sha256:0000000000000000000000000000000000000000000000000000000000000000"
    },
    "collision": {
      "boxes": [{ "min_x": 0, "min_y": 0, "min_z": 0, "max_x": 1, "max_y": 0.0625, "max_z": 1 }],
      "signature": "sha256:0000000000000000000000000000000000000000000000000000000000000000"
    },
    "behavior_fingerprint": "sha256:0000000000000000000000000000000000000000000000000000000000000000",
    "behavior_by_state": {
      "minecraft:yellow_carpet": {
        "transparent": false,
        "emissive": false,
        "passable": false,
        "waterloggable": false,
        "redstone_related": false,
        "requires_support": true,
        "support": {
          "above": "unknown",
          "below": true,
          "east": "unknown",
          "north": "unknown",
          "south": "unknown",
          "west": "unknown",
          "none": false
        },
        "emission_level": 0
      }
    }
  },
  "render": {
    "render_policy_version": "render.v1",
    "preview_path": "renders/minecraft/yellow_carpet/preview.png",
    "mask_path": "renders/minecraft/yellow_carpet/mask.png",
    "render_metadata_path": "renders/minecraft/yellow_carpet/render.json",
    "image_sha256": "sha256:0000000000000000000000000000000000000000000000000000000000000000",
    "mask_sha256": "sha256:0000000000000000000000000000000000000000000000000000000000000000",
    "render_metadata_sha256": "sha256:0000000000000000000000000000000000000000000000000000000000000000"
  },
  "source": {
    "type": "machine",
    "minecraft_version": "26.2",
    "export_id": "export_20260814T165501Z",
    "producer_version": "1.0.0",
    "stage": "RENDER_VARIANTS"
  }
}
